{"derivation_id":"P04_CELL_ORDER_INDEPENDENCE","expected_conclusion":{"cell_order":"FINITE_PERMUTATION_INVARIANT","normal_form":"SUM_BY_CELL_LABEL(P_c tensor gamma5 tensor iota_c(c_c))"},"gaps":[],"proof_axioms":["SEALED_SOURCE_ASSERTION","DEFINITIONAL_UNFOLDING","FINITE_QUOTIENT_NORMALIZATION","FINITE_REINDEXING","LINEAR_PROJECTOR_CALCULATION","TENSOR_FACTOR_NORMALIZATION","CAR_NUMBER_SECTOR_RELATIONS","CONJUNCTION_INTRODUCTION"],"row_id":"C-B-V011-SP2-05","schema":"rd22.step11.sp2-05.proof-object.v001","status":"KERNEL_READY","steps":[{"citations":[{"block_id":"B_GLOBAL_DESCENT","relative_path":"review_packets/STAGE7_QSPEC_CANDIDATE_V001/BID_GLOBAL_BOUNDARY_DESCENT_QUASI_FREE_COMPLETENESS_V001.md","source_sha256":"949181d78aca143ebef06eacc4ab1018d43cdf79962ee8c78c350f654a7555dd","span":[1705,4005],"span_sha256":"fcbb16c6cad76b08a210d55d42a1ce82d165ae3a0adfd63f28ba16f30946d1ce"}],"inference":"DEFINITIONAL_UNFOLDING","premises":[],"statement":{"finite_sum":"sum_(c in K) P_c tensor gamma5 tensor iota_c(c_c)"},"step_id":"s01"},{"citations":[{"block_id":"B_GLOBAL_DESCENT","relative_path":"review_packets/STAGE7_QSPEC_CANDIDATE_V001/BID_GLOBAL_BOUNDARY_DESCENT_QUASI_FREE_COMPLETENESS_V001.md","source_sha256":"949181d78aca143ebef06eacc4ab1018d43cdf79962ee8c78c350f654a7555dd","span":[1705,4005],"span_sha256":"fcbb16c6cad76b08a210d55d42a1ce82d165ae3a0adfd63f28ba16f30946d1ce"},{"block_id":"B_GLOBAL_ORDER","relative_path":"review_packets/STAGE7_QSPEC_CANDIDATE_V001/BID_GLOBAL_BOUNDARY_DESCENT_QUASI_FREE_COMPLETENESS_V001.md","source_sha256":"949181d78aca143ebef06eacc4ab1018d43cdf79962ee8c78c350f654a7555dd","span":[5027,6406],"span_sha256":"17314d1ffd972873a65ee99e3309610b70e25dfddf612dd7adb2a83df456d7ed"}],"inference":"FINITE_REINDEXING","premises":["s01"],"statement":{"cell_order":"FINITE_PERMUTATION_INVARIANT","normal_form":"SUM_BY_CELL_LABEL(P_c tensor gamma5 tensor iota_c(c_c))"},"step_id":"s02"}],"target_opcode":"KERNEL","used_axiom_hashes":[],"used_source_sha256s":["949181d78aca143ebef06eacc4ab1018d43cdf79962ee8c78c350f654a7555dd"]}