{"derivation_id":"O01_SOURCE_PROJECTOR_REVERSAL","expected_conclusion":{"calculation":"|-d><-d|/<-d,-d>=|d><d|/<d,d>","projector":"P_c(-d_c)=P_c(d_c)"},"gaps":[],"proof_axioms":["SEALED_SOURCE_ASSERTION","DEFINITIONAL_UNFOLDING","FINITE_QUOTIENT_NORMALIZATION","FINITE_REINDEXING","LINEAR_PROJECTOR_CALCULATION","TENSOR_FACTOR_NORMALIZATION","CAR_NUMBER_SECTOR_RELATIONS","CONJUNCTION_INTRODUCTION"],"row_id":"C-B-V011-SP2-05","schema":"rd22.step11.sp2-05.proof-object.v001","status":"KERNEL_READY","steps":[{"citations":[{"block_id":"B_GLOBAL_DESCENT","relative_path":"review_packets/STAGE7_QSPEC_CANDIDATE_V001/BID_GLOBAL_BOUNDARY_DESCENT_QUASI_FREE_COMPLETENESS_V001.md","source_sha256":"949181d78aca143ebef06eacc4ab1018d43cdf79962ee8c78c350f654a7555dd","span":[1705,4005],"span_sha256":"fcbb16c6cad76b08a210d55d42a1ce82d165ae3a0adfd63f28ba16f30946d1ce"}],"inference":"SEALED_SOURCE_ASSERTION","premises":[],"statement":{"orientation_reversal":"d_c -> -d_c","projector":"|d_c><d_c|/<d_c,d_c>"},"step_id":"s01"},{"citations":[{"block_id":"B_GLOBAL_DESCENT","relative_path":"review_packets/STAGE7_QSPEC_CANDIDATE_V001/BID_GLOBAL_BOUNDARY_DESCENT_QUASI_FREE_COMPLETENESS_V001.md","source_sha256":"949181d78aca143ebef06eacc4ab1018d43cdf79962ee8c78c350f654a7555dd","span":[1705,4005],"span_sha256":"fcbb16c6cad76b08a210d55d42a1ce82d165ae3a0adfd63f28ba16f30946d1ce"}],"inference":"LINEAR_PROJECTOR_CALCULATION","premises":["s01"],"statement":{"calculation":"|-d><-d|/<-d,-d>=|d><d|/<d,d>","projector":"P_c(-d_c)=P_c(d_c)"},"step_id":"s02"}],"target_opcode":"KERNEL","used_axiom_hashes":[],"used_source_sha256s":["949181d78aca143ebef06eacc4ab1018d43cdf79962ee8c78c350f654a7555dd"]}